{"protocol_version":"1.0","mode":"stateless","skill":"design-codebase","minimum_python":"3.11","run_dir_policy":"outside_skill_and_repo","requirements":[],"inputs":[{"name":"draft","kind":"path","required":true,"repeatable":false,"description":"Agent-authored design handoff.","choices":[]},{"name":"output_dir","kind":"path","required":true,"repeatable":false,"description":"Directory receiving only design-handoff.md.","choices":[]}],"artifacts":[],"phases":{},"commands":{"run":{"allowed_phases":[],"success_phase":null,"steps":[{"argv":["{python}","{skill_dir}/scripts/seal_assessment.py","--repo-root","{repo_root}","--output-dir","{input.output_dir}","--format","json","{input.draft}"],"repeat":[],"capture_stdout":null,"diagnostics_json":true,"failure":"blocked"}]}}}
