{"protocol_version":"1.0","mode":"stateless","skill":"scope-issue","minimum_python":"3.11","run_dir_policy":"outside_skill_and_repo","requirements":[],"inputs":[{"name":"issue_json","kind":"path","required":true,"repeatable":false,"description":"Agent-selected single issue JSON.","choices":[]},{"name":"draft","kind":"path","required":true,"repeatable":false,"description":"Agent-authored issue handoff draft.","choices":[]},{"name":"output_dir","kind":"path","required":true,"repeatable":false,"description":"Directory receiving only issue-handoff.md.","choices":[]}],"artifacts":[],"phases":{},"commands":{"run":{"allowed_phases":[],"success_phase":null,"steps":[{"argv":["{python}","{skill_dir}/scripts/seal_issue_plan.py","--repo-root","{repo_root}","--issue-json","{input.issue_json}","--draft","{input.draft}","--output-dir","{input.output_dir}"],"repeat":[],"capture_stdout":null,"diagnostics_json":true,"failure":"blocked"}]}}}
