{
  "protocol_version": "1.0",
  "mode": "stateless",
  "skill": "route-engineering-work",
  "minimum_python": "3.11",
  "run_dir_policy": "outside_skill",
  "requirements": [],
  "inputs": [
    {"name": "request", "kind": "string", "required": true, "repeatable": false, "description": "Engineering request to classify without executing.", "choices": []},
    {"name": "repository_navigation_inadequate", "kind": "choice", "required": false, "repeatable": false, "description": "Explicit caller signal that native repository navigation was insufficient.", "choices": ["true"]}
  ],
  "artifacts": [],
  "phases": {},
  "commands": {
    "run": {
      "allowed_phases": [],
      "success_phase": null,
      "steps": [
        {
          "argv": ["{python}", "{skill_dir}/scripts/route_engineering_work.py", "--request", "{input.request}", "--repo-root", "{repo_root}"],
          "repeat": [{"input": "repository_navigation_inadequate", "flag": "--repository-navigation-inadequate"}],
          "capture_stdout": null,
          "diagnostics_json": true,
          "failure": "blocked"
        }
      ]
    }
  }
}
