{"protocol_version":"1.0","mode":"stateless","skill":"raise-issue","minimum_python":"3.11","run_dir_policy":"outside_skill_and_repo","requirements":[],"inputs":[{"name":"handoff","kind":"path","required":true,"repeatable":false,"description":"Sealed audit handoff.","choices":[]},{"name":"github_repo_url","kind":"string","required":true,"repeatable":false,"description":"Explicit GitHub destination.","choices":[]}],"artifacts":[],"phases":{},"commands":{"run":{"allowed_phases":[],"success_phase":null,"steps":[{"argv":["{python}","{skill_dir}/scripts/publish_github_issues.py","--handoff","{input.handoff}","--github-repo-url","{input.github_repo_url}"],"repeat":[],"capture_stdout":null,"diagnostics_json":false,"failure":"blocked"}]}}}
